{
  "contractVersion": "rkm-canonical-rag-evidence-projection-v1",
  "entities": [
    {
      "attributes": {
        "bundleId": "nasa-space-exploration-rag-evidence-v1",
        "sha256": "44e93c51f2dbb277dbf5bc29a8f844ab9bdd51c01c4d53327f2dff03f874fc8d",
        "version": "1.0.0"
      },
      "entityType": "Artifact",
      "id": "ARTIFACT-1001",
      "name": "External RAG evidence bundle",
      "provenance": {
        "bundleId": "nasa-space-exploration-rag-evidence-v1",
        "bundleSha256": "44e93c51f2dbb277dbf5bc29a8f844ab9bdd51c01c4d53327f2dff03f874fc8d",
        "reviewId": "nasa-space-exploration-source-review-2026-07-30",
        "reviewSha256": "22f2c00f219767b9de584279f5a5fe03456e806726d9004a784f9cc01b4702be",
        "reviewedAt": "2026-07-30",
        "reviewer": "Andrea Tarsi",
        "scope": "INTERNAL_EVALUATION_ONLY"
      },
      "slug": "external-evidence-bundle",
      "status": "Reviewed"
    },
    {
      "attributes": {
        "id": "space-exploration-v1",
        "path": "src/test/resources/evaluation/space-corpus-v1.json",
        "sha256": "3c5be7b94065f4e6e2ecdfbafde926f57b2b912741f2de61bcac42ba8db30d4b",
        "version": "1.0.0"
      },
      "entityType": "Dataset",
      "id": "DATASET-1001",
      "name": "Space exploration corpus",
      "provenance": {
        "bundleId": "nasa-space-exploration-rag-evidence-v1",
        "bundleSha256": "44e93c51f2dbb277dbf5bc29a8f844ab9bdd51c01c4d53327f2dff03f874fc8d",
        "reviewId": "nasa-space-exploration-source-review-2026-07-30",
        "reviewSha256": "22f2c00f219767b9de584279f5a5fe03456e806726d9004a784f9cc01b4702be",
        "reviewedAt": "2026-07-30",
        "reviewer": "Andrea Tarsi",
        "scope": "INTERNAL_EVALUATION_ONLY"
      },
      "slug": "space-exploration-corpus",
      "status": "Reviewed"
    },
    {
      "attributes": {
        "id": "space-exploration-golden-v1",
        "path": "src/test/resources/evaluation/space-golden-dataset-v1.json",
        "sha256": "7c7c59829502a9c087f31c5c637a4aa88b81c952be35482ee706542bb0945d03",
        "version": "1.0.0"
      },
      "entityType": "Dataset",
      "id": "DATASET-1002",
      "name": "Space exploration golden dataset",
      "provenance": {
        "bundleId": "nasa-space-exploration-rag-evidence-v1",
        "bundleSha256": "44e93c51f2dbb277dbf5bc29a8f844ab9bdd51c01c4d53327f2dff03f874fc8d",
        "reviewId": "nasa-space-exploration-source-review-2026-07-30",
        "reviewSha256": "22f2c00f219767b9de584279f5a5fe03456e806726d9004a784f9cc01b4702be",
        "reviewedAt": "2026-07-30",
        "reviewer": "Andrea Tarsi",
        "scope": "INTERNAL_EVALUATION_ONLY"
      },
      "slug": "space-exploration-golden-dataset",
      "status": "Reviewed"
    },
    {
      "attributes": {
        "id": "offline-rag-e2e-walkthrough",
        "path": "examples/fixtures/rag-recommendation-report-v1-generated.json",
        "sha256": "3f8a2e8e9296546b57aeda8904f9bf0db61127ce7bd09a17484f91089824927f",
        "version": "1.0.0"
      },
      "entityType": "Artifact",
      "id": "ARTIFACT-1002",
      "name": "Offline RAG generated artifact",
      "provenance": {
        "bundleId": "nasa-space-exploration-rag-evidence-v1",
        "bundleSha256": "44e93c51f2dbb277dbf5bc29a8f844ab9bdd51c01c4d53327f2dff03f874fc8d",
        "reviewId": "nasa-space-exploration-source-review-2026-07-30",
        "reviewSha256": "22f2c00f219767b9de584279f5a5fe03456e806726d9004a784f9cc01b4702be",
        "reviewedAt": "2026-07-30",
        "reviewer": "Andrea Tarsi",
        "scope": "INTERNAL_EVALUATION_ONLY"
      },
      "slug": "offline-rag-e2e-walkthrough",
      "status": "Reviewed"
    },
    {
      "attributes": {
        "id": "offline-rag-e2e-walkthrough-decision",
        "path": "examples/fixtures/rkm-rag-recommendation-decision-v1.json",
        "sha256": "f91f59006e668b02fac97e1443c7ed07db03ced2daf337db6332a22520f87d39",
        "version": "1.0.0"
      },
      "entityType": "Artifact",
      "id": "ARTIFACT-1003",
      "name": "Offline RAG decision record",
      "provenance": {
        "bundleId": "nasa-space-exploration-rag-evidence-v1",
        "bundleSha256": "44e93c51f2dbb277dbf5bc29a8f844ab9bdd51c01c4d53327f2dff03f874fc8d",
        "reviewId": "nasa-space-exploration-source-review-2026-07-30",
        "reviewSha256": "22f2c00f219767b9de584279f5a5fe03456e806726d9004a784f9cc01b4702be",
        "reviewedAt": "2026-07-30",
        "reviewer": "Andrea Tarsi",
        "scope": "INTERNAL_EVALUATION_ONLY"
      },
      "slug": "offline-rag-e2e-walkthrough-decision",
      "status": "Reviewed"
    },
    {
      "attributes": {
        "costCurrency": "LOCAL",
        "estimatedCost": 0.001,
        "experimentId": "offline-rag-e2e-walkthrough",
        "interpretation": "Naive is selected for this provider-free walkthrough because all eligible pipelines reached the measured quality floor and it won the bounded latency and local estimated-cost tie-breaks. This is evidence for this corpus and experiment, not a universal strategy ranking.",
        "latencyP95Ms": 10,
        "policyVersion": "quality-cost-profiles-v1",
        "qualityScore": 1.0,
        "recommendedIndexProfileId": "offline-fixture-index-v1",
        "recommendedPipelineId": "naive"
      },
      "entityType": "Benchmark",
      "id": "BENCHMARK-1001",
      "name": "Offline RAG evaluation walkthrough",
      "provenance": {
        "bundleId": "nasa-space-exploration-rag-evidence-v1",
        "bundleSha256": "44e93c51f2dbb277dbf5bc29a8f844ab9bdd51c01c4d53327f2dff03f874fc8d",
        "reviewId": "nasa-space-exploration-source-review-2026-07-30",
        "reviewSha256": "22f2c00f219767b9de584279f5a5fe03456e806726d9004a784f9cc01b4702be",
        "reviewedAt": "2026-07-30",
        "reviewer": "Andrea Tarsi",
        "scope": "INTERNAL_EVALUATION_ONLY"
      },
      "slug": "offline-rag-e2e-walkthrough",
      "status": "Reviewed"
    },
    {
      "attributes": {
        "attribution": "NASA",
        "canonicalUrl": "https://www.nasa.gov/artemisaudio/",
        "id": "nasa-artemis-audio",
        "kind": "audio",
        "retrievalDate": "2026-07-27",
        "rights": "NASA audio usage guidelines; no implied endorsement; third-party material excluded",
        "sourceIdentitySha256": "8f57bb797d4de68160139b58049de4ff54d747347d4835f6b22610d6a90eb918",
        "title": "Artemis Audio Library"
      },
      "entityType": "Reference",
      "id": "REFERENCE-1001",
      "name": "Artemis Audio Library",
      "provenance": {
        "bundleId": "nasa-space-exploration-rag-evidence-v1",
        "bundleSha256": "44e93c51f2dbb277dbf5bc29a8f844ab9bdd51c01c4d53327f2dff03f874fc8d",
        "reviewId": "nasa-space-exploration-source-review-2026-07-30",
        "reviewSha256": "22f2c00f219767b9de584279f5a5fe03456e806726d9004a784f9cc01b4702be",
        "reviewedAt": "2026-07-30",
        "reviewer": "Andrea Tarsi",
        "scope": "INTERNAL_EVALUATION_ONLY"
      },
      "slug": "nasa-artemis-audio",
      "status": "Reviewed"
    },
    {
      "attributes": {
        "basis": "Official NASA source reviewed for internal evaluation metadata and attribution consistency.",
        "decision": "APPROVED",
        "sourceId": "nasa-artemis-audio"
      },
      "entityType": "Evidence",
      "id": "EVIDENCE-1001",
      "name": "Human review of Artemis Audio Library",
      "provenance": {
        "bundleId": "nasa-space-exploration-rag-evidence-v1",
        "bundleSha256": "44e93c51f2dbb277dbf5bc29a8f844ab9bdd51c01c4d53327f2dff03f874fc8d",
        "reviewId": "nasa-space-exploration-source-review-2026-07-30",
        "reviewSha256": "22f2c00f219767b9de584279f5a5fe03456e806726d9004a784f9cc01b4702be",
        "reviewedAt": "2026-07-30",
        "reviewer": "Andrea Tarsi",
        "scope": "INTERNAL_EVALUATION_ONLY"
      },
      "slug": "nasa-artemis-audio-review",
      "status": "Reviewed"
    },
    {
      "attributes": {
        "attribution": "NASA",
        "canonicalUrl": "https://www.nasa.gov/general/artemis-i-media-resources/",
        "id": "nasa-artemis-i-media",
        "kind": "video",
        "retrievalDate": "2026-07-27",
        "rights": "NASA media usage guidelines; third-party material and endorsements excluded",
        "sourceIdentitySha256": "f2e85194f8fa4a7fdbb0dbce4ccac609e1d9875488a0085e02af1ac604e39c9e",
        "title": "Artemis I Media Resources"
      },
      "entityType": "Reference",
      "id": "REFERENCE-1002",
      "name": "Artemis I Media Resources",
      "provenance": {
        "bundleId": "nasa-space-exploration-rag-evidence-v1",
        "bundleSha256": "44e93c51f2dbb277dbf5bc29a8f844ab9bdd51c01c4d53327f2dff03f874fc8d",
        "reviewId": "nasa-space-exploration-source-review-2026-07-30",
        "reviewSha256": "22f2c00f219767b9de584279f5a5fe03456e806726d9004a784f9cc01b4702be",
        "reviewedAt": "2026-07-30",
        "reviewer": "Andrea Tarsi",
        "scope": "INTERNAL_EVALUATION_ONLY"
      },
      "slug": "nasa-artemis-i-media",
      "status": "Reviewed"
    },
    {
      "attributes": {
        "basis": "Official NASA source reviewed for internal evaluation metadata and attribution consistency.",
        "decision": "APPROVED",
        "sourceId": "nasa-artemis-i-media"
      },
      "entityType": "Evidence",
      "id": "EVIDENCE-1002",
      "name": "Human review of Artemis I Media Resources",
      "provenance": {
        "bundleId": "nasa-space-exploration-rag-evidence-v1",
        "bundleSha256": "44e93c51f2dbb277dbf5bc29a8f844ab9bdd51c01c4d53327f2dff03f874fc8d",
        "reviewId": "nasa-space-exploration-source-review-2026-07-30",
        "reviewSha256": "22f2c00f219767b9de584279f5a5fe03456e806726d9004a784f9cc01b4702be",
        "reviewedAt": "2026-07-30",
        "reviewer": "Andrea Tarsi",
        "scope": "INTERNAL_EVALUATION_ONLY"
      },
      "slug": "nasa-artemis-i-media-review",
      "status": "Reviewed"
    },
    {